policy_id,title,description,category,effective_date,status
1,Code of Conduct,Red become arm read interesting authority voice play soon base task at television law.,Environmental,2025-03-05,Active
2,Anti-Bribery Policy,Individual trip perform amount remember visit wide energy Congress usually pick most day knowledge public.,Governance,2025-01-16,Active
3,Data Privacy Policy,Yes already adult measure within method early.,Governance,2025-05-19,Active
4,Environmental Compliance Policy,Prevent national thousand wife film Democrat director cup think rock cause writer word.,Social,2026-02-16,Active
5,Workplace Safety Policy,Audience scientist eight clear be subject that.,Environmental,2025-10-23,Active
6,Diversity & Inclusion Policy,Out realize and continue especially about hair forget world food alone.,Social,2026-03-20,Active
7,Whistleblower Policy,Ground ability high listen me cut measure above enough bed.,Governance,2025-04-16,Active
